{"baselineId":"sha256:aaaaaaaaaaaaaaaaaaaaaaaaaaaaaaaaaaaaaaaaaaaaaaaaaaaaaaaaaaaaaaaa","budgets":{"maxCostRegressionPercent":15,"maxInputTokens":1500,"maxMonthlyCost":500,"maxTokenRegressionPercent":10},"contract":{"kind":"policy","version":{"major":1,"minor":1}},"enforcement":"fail","pricing":{"catalogueDate":"2026-08-10","currency":"USD","modelId":"gpt-5"},"provenance":{"generatedAt":"2026-08-13T15:00:00.000Z","producer":"savedyouatoken","producerVersion":"0.1.0"},"target":{"environment":"production","id":"support/triage"}}
