{"baselineId":"sha256:f8b2e58689658c92b605b85aa59f46c8eb3d8dfd3eb95b3a510d212761c66952","budgets":{"maxCostRegressionPercent":10,"maxInputTokens":1670,"maxMonthlyCost":268.87,"maxTokenRegressionPercent":10},"contract":{"kind":"policy","version":{"major":1,"minor":1}},"enforcement":"warn","pricing":{"catalogueDate":"2026-08-10","currency":"USD","modelId":"claude-sonnet-5"},"provenance":{"generatedAt":"2026-08-17T19:31:46.203Z","producer":"savedyouatoken","producerVersion":"0.1.0"},"target":{"id":"examples/support-triage"}}
